[
  {
    "synthetic": true,
    "account_id": "SYNTHETIC-ACCT-0001",
    "transaction_id": "SYNTHETIC-TXN-0001",
    "independence_status": "INDEPENDENT",
    "participant_side": "SUPPLIER",
    "role_archetype": "synthetic security lead",
    "transaction_type": "PRODUCTION_ONBOARDING",
    "within_12_months": true,
    "supplier_profile_band": "synthetic small supplier band",
    "buyer_profile_band": "synthetic enterprise band",
    "geography_band": "synthetic UK",
    "deployment_stage": "synthetic production onboarding",
    "trigger": "synthetic buyer review",
    "review_types": ["INFORMATION_SECURITY", "AI_GOVERNANCE"],
    "requirements": [{"requirement_id": "SYN-R1", "category": "TECHNICAL_ARTEFACT", "evidence_state": "CREATED", "corroboration_state": "PARTICIPANT_REPORTED", "requester_role": "synthetic security reviewer", "reviewer_role": "synthetic technical assurance", "acceptance_outcome": "synthetic accepted with conditions", "observability": "CI_TEST_ARTEFACT", "observability_basis": "synthetic analyst coding", "uncertainty": "synthetic recalled account"}],
    "burden": {"lower": 8, "upper": 16, "unit": "PERSON_HOURS", "basis": "synthetic recalled range", "affected_role": "synthetic security lead", "uncertainty": "synthetic not recorded"},
    "delay": {"lower": 3, "upper": 7, "unit": "CALENDAR_DAYS", "basis": "synthetic recalled range", "affected_role": "synthetic transaction", "uncertainty": "synthetic not recorded"},
    "outcome": "synthetic accepted with conditions",
    "blocker_role": "synthetic security reviewer",
    "residual_risk_approver_role": "synthetic risk owner",
    "independent_review_required": "UNKNOWN",
    "actual_expenditure_or_commitment": {"occurred": "UNKNOWN", "role": "synthetic unknown", "purpose": "synthetic review", "basis": "synthetic no evidence"},
    "current_substitute": "synthetic spreadsheet",
    "substitute_result": "MIXED",
    "substitute_result_basis": "synthetic rework account",
    "contradiction": false,
    "contradiction_basis": "synthetic none observed",
    "negative_case": false,
    "negative_case_basis": "synthetic burden present",
    "unresolved_questions": ["synthetic buyer-side match"]
  },
  {
    "synthetic": true,
    "account_id": "SYNTHETIC-ACCT-0002",
    "transaction_id": "SYNTHETIC-TXN-0002",
    "independence_status": "INDEPENDENT",
    "participant_side": "BUYER_REVIEWER",
    "role_archetype": "synthetic risk reviewer",
    "transaction_type": "PROCUREMENT_REVIEW",
    "within_12_months": true,
    "supplier_profile_band": "synthetic supplier band",
    "buyer_profile_band": "synthetic enterprise band",
    "geography_band": "synthetic UK",
    "deployment_stage": "synthetic procurement",
    "trigger": "synthetic standard review",
    "review_types": ["THIRD_PARTY_RISK"],
    "requirements": [{"requirement_id": "SYN-R2", "category": "SUPPLIER_ATTESTATION", "evidence_state": "ACCEPTED", "corroboration_state": "BUYER_CONFIRMED", "requester_role": "synthetic risk reviewer", "reviewer_role": "synthetic risk reviewer", "acceptance_outcome": "synthetic accepted", "observability": "SUPPLIER_ATTESTED", "observability_basis": "synthetic analyst coding", "uncertainty": "synthetic none"}],
    "burden": {"lower": 0, "upper": 1, "unit": "PERSON_HOURS", "basis": "synthetic recalled range", "affected_role": "synthetic reviewer", "uncertainty": "synthetic"},
    "delay": {"lower": 0, "upper": 0, "unit": "CALENDAR_DAYS", "basis": "synthetic no delay", "affected_role": "synthetic transaction", "uncertainty": "synthetic"},
    "outcome": "synthetic incumbent workflow adequate",
    "blocker_role": "synthetic risk reviewer",
    "residual_risk_approver_role": "synthetic risk owner",
    "independent_review_required": "NO",
    "actual_expenditure_or_commitment": {"occurred": "NO", "role": "synthetic buyer", "purpose": "synthetic review", "basis": "synthetic no purchase"},
    "current_substitute": "synthetic incumbent portal",
    "substitute_result": "ADEQUATE",
    "substitute_result_basis": "synthetic fast-pass account",
    "contradiction": true,
    "contradiction_basis": "synthetic contradicts proposed advantage",
    "negative_case": true,
    "negative_case_basis": "synthetic incumbent adequate and technical share negligible",
    "unresolved_questions": []
  }
]
